{"campaign":{"acceptance":{"bytes":2618,"path":"inputs/acceptance.json","sha256":"547768c0edc4be7b6d0206140d6c8a453d5a867a4bf8339f7a8e806421a9cbb3"},"candidate_id":"c0151-v10-c1","id":"c0151-formal-rule-correction-20260905t0033z"},"candidate":{"build_id":"sub2api-0.1.180-3-c0151-v10-c1-d0fe5d7e6-candidatecapture-arm64","deployed_version":"0.1.180-3","image_id":"sha256:de96a14c02b03db37b960e61a32f38e6e84b9afb408bfb282378e608974a9fda","image_reference":"sub2apiplus-c0151-v10-candidate@sha256:de96a14c02b03db37b960e61a32f38e6e84b9afb408bfb282378e608974a9fda","package_digest":"41a9ba84b407cb9b6ee7f4f10c07f5c8aa0fa0d9d27c0ba59c8df0b919bb746c","source_tree_sha256":"d90816dd26551feff23193e8f726e0707141ad490a172af3b579f037d3e8b289"},"completed_at_utc":"2026-09-06T14:06:56Z","final_state":{"active_version":"0.151.0","candidate_id":"c0151-v10-c1","container_status":"running","health":"pass","image_id":"sha256:bb100c8b077a8a70dba1ec443fbb2e1f94da279e7fe0d08ca2e5f0aca2768c2c","profile_digest":"dbc65378c80a2ad843ce1ba6253a2e47f0dd5d8bc812bb536a2d24ddb7a59e39","profile_id":"codex-0.151.0-official-r151-v1"},"post_promotion_gate":{"bytes":7550,"path":"post-promotion-gates/receipt.json","sha256":"bdf54b40966c4e421c03632bc0a8217f6e5b5e172732ab55c37f45a463447909"},"producer":{"facts":{"bytes":8558,"path":"activation-facts.json","sha256":"3be5f92ca229f3b6399ce0a89eac11b43a2a6c2050c7f99f6e712d7d6f79427e"},"schema_version":"codex-production-activation-producer/v2","tool":"/root/oauth-capture/tools/official_client_capture/production_activation_receipt.py","tool_sha256":"3b4ddbf874a9164654e8496fb6f2a88fbd50b22557f16b5285f0aa0aca7d1292"},"promotion":{"bytes":2885,"path":"inputs/promotion.json","sha256":"2592a01114bdea0f7d873b13b993c0098d77c72a9eea64f9bc1385ed057fa223"},"rollback":{"build_id":"sub2api-0.1.180-3-e9fb45cf8-official-arm64","deployed_version":"0.1.180-3","image_id":"sha256:e67e6066c2ec0990fc8314675fdcd82d3bc37b5727f65d097356abe13f17bcbe","image_reference":"ghcr.io/itv3/sub2apiplus@sha256:e67e6066c2ec0990fc8314675fdcd82d3bc37b5727f65d097356abe13f17bcbe","profile_digest":"8c22d3b18b16d249ac041a97efad1b6703c11ef290622b0b1642679a3c010ec3","profile_id":"codex-0.149.1-official-r1491-v2","source_tree_sha256":"c1ab92d4df0b9101d057978dd94f5a83fd61eac829c0c9f4a0fc87935533b87b","version":"0.149.1"},"schema_version":"codex-production-activation-receipt/v2","stages":[{"architecture":"linux/arm64","checks":{"active_version":"0.151.0","container_status":"running","fatal_log_count":0,"guard_failure_count":0,"health":"pass","profile_digest":"dbc65378c80a2ad843ce1ba6253a2e47f0dd5d8bc812bb536a2d24ddb7a59e39"},"completed_at_utc":"2026-09-06T13:58:20Z","evidence":[{"bytes":970,"path":"canary/activation-fact.json","sha256":"db7ee245904321f3bffa4d5ee58ba36b4068ef5799363ab7bcd4dd42136f68b5"},{"bytes":12461,"path":"canary/container-inspect.json","sha256":"4ac4bf82d2ac34d9e64125214c31998e491771ab3693d377d975c606e378aeb4"},{"bytes":13539,"path":"canary/app.log","sha256":"2a3fd19809bdeb4af9156f2e6aa95827b8ed1563a2392537d5d697b29c96cb47"},{"bytes":529,"path":"canary/stage.json","sha256":"b06a46487c39f283d64aa62af46275b0d976c780e87ac77eb13b5dffc276c743"}],"host":"ARM64","image_id":"sha256:bb100c8b077a8a70dba1ec443fbb2e1f94da279e7fe0d08ca2e5f0aca2768c2c","name":"canary","started_at_utc":"2026-09-06T13:58:12Z","status":"pass"},{"architecture":"linux/arm64","checks":{"active_version":"0.151.0","capture_cli_ip":"172.30.0.10","container_status":"running","dependency_containers_unchanged":true,"fatal_log_count":0,"guard_failure_count":0,"health":"pass","profile_digest":"dbc65378c80a2ad843ce1ba6253a2e47f0dd5d8bc812bb536a2d24ddb7a59e39","public_egress":"179.255.100.158","sub2apiplus_ip":"172.25.0.3","wg1_mtu":1420},"completed_at_utc":"2026-09-06T14:06:17Z","evidence":[{"bytes":970,"path":"stages/production_switch/activation-fact.json","sha256":"22a06af6f4aa8d543e98ddb38349ba864ecaffa84fec63860a2f12839337ec0b"},{"bytes":15,"path":"stages/production_switch/health-response.txt","sha256":"a29ee2b15c494311c52521766e44af56a3ad2248e7a8ab465e5206463c13d288"},{"bytes":1952,"path":"stages/production_switch/state.json","sha256":"fafe1478c28d80a133ad0f9aa20c29ab3a56ce98b7d40dfc66a34e1c17e91194"},{"bytes":887,"path":"stages/production_switch/environment-receipt.json","sha256":"35149e8a47b4701a4378b321242ef9e0f7ed7b5d828c803397fb22232a333d22"}],"host":"22-7-28-0641","image_id":"sha256:bb100c8b077a8a70dba1ec443fbb2e1f94da279e7fe0d08ca2e5f0aca2768c2c","name":"production_switch","started_at_utc":"2026-09-06T14:05:57Z","status":"pass"},{"architecture":"linux/arm64","checks":{"active_version":"0.149.1","capture_cli_ip":"172.30.0.10","container_status":"running","dependency_containers_unchanged":true,"fatal_log_count":0,"guard_failure_count":0,"health":"pass","profile_digest":"8c22d3b18b16d249ac041a97efad1b6703c11ef290622b0b1642679a3c010ec3","public_egress":"179.255.100.158","sub2apiplus_ip":"172.25.0.3","wg1_mtu":1420},"completed_at_utc":"2026-09-06T14:06:37Z","evidence":[{"bytes":945,"path":"stages/rollback/activation-fact.json","sha256":"4b19a09fa35474761ca3c610484789a98256b625743bce6d1f05fec58f70f18c"},{"bytes":15,"path":"stages/rollback/health-response.txt","sha256":"a29ee2b15c494311c52521766e44af56a3ad2248e7a8ab465e5206463c13d288"},{"bytes":1909,"path":"stages/rollback/state.json","sha256":"182bdd58f707551a1565325d1fa72e2756d26d0e839bdd4a690f5f37cf0bb1fa"},{"bytes":869,"path":"stages/rollback/environment-receipt.json","sha256":"31308baca8519f958fb4038ee3e42e3e6f4c2a8e6c3dea9e58afbbd3e1f0a544"}],"host":"22-7-28-0641","image_id":"sha256:e67e6066c2ec0990fc8314675fdcd82d3bc37b5727f65d097356abe13f17bcbe","name":"rollback","started_at_utc":"2026-09-06T14:06:18Z","status":"pass"},{"architecture":"linux/arm64","checks":{"active_version":"0.151.0","capture_cli_ip":"172.30.0.10","container_status":"running","dependency_containers_unchanged":true,"fatal_log_count":0,"guard_failure_count":0,"health":"pass","profile_digest":"dbc65378c80a2ad843ce1ba6253a2e47f0dd5d8bc812bb536a2d24ddb7a59e39","public_egress":"179.255.100.158","sub2apiplus_ip":"172.25.0.3","wg1_mtu":1420},"completed_at_utc":"2026-09-06T14:06:56Z","evidence":[{"bytes":970,"path":"stages/target_restore/activation-fact.json","sha256":"a28ef99cb26ddcc87e5e23c3a326124853dee99efbed8910fcce51b9643a6160"},{"bytes":15,"path":"stages/target_restore/health-response.txt","sha256":"a29ee2b15c494311c52521766e44af56a3ad2248e7a8ab465e5206463c13d288"},{"bytes":1946,"path":"stages/target_restore/state.json","sha256":"2577f0ae269a446d675d481213e8ea27db273bc58056c6ab6de370427ee39a61"},{"bytes":881,"path":"stages/target_restore/environment-receipt.json","sha256":"8a5d17c82b2d5f176f51618160357d8e48cc27b1c8ceecaac21e5621a96401c2"}],"host":"22-7-28-0641","image_id":"sha256:bb100c8b077a8a70dba1ec443fbb2e1f94da279e7fe0d08ca2e5f0aca2768c2c","name":"target_restore","started_at_utc":"2026-09-06T14:06:38Z","status":"pass"}],"target":{"build_id":"sub2api-0.1.180-3-c0151-v10-c1-d0fe5d7e6-production-arm64","deployed_version":"0.1.180-3","image_id":"sha256:bb100c8b077a8a70dba1ec443fbb2e1f94da279e7fe0d08ca2e5f0aca2768c2c","image_reference":"sub2apiplus-c0151-v10-c1-production@sha256:bb100c8b077a8a70dba1ec443fbb2e1f94da279e7fe0d08ca2e5f0aca2768c2c","profile_digest":"dbc65378c80a2ad843ce1ba6253a2e47f0dd5d8bc812bb536a2d24ddb7a59e39","profile_id":"codex-0.151.0-official-r151-v1","source_tree_sha256":"8bf3b3d3f0db05b76a3999173cc363cca555aaac6ce7da7cd6099684d4b436e1","version":"0.151.0"}}
